{
  "omst_type": "evaluation-package",
  "package_id": "pkg-tokenized-bond-dvp-eur-x-v07",
  "package_version": "0.7.0",
  "lifecycle_status": "SEALED",
  "omst_version": "0.7.0",
  "schema_version": "0.7.0",
  "ruleset_version": "omst-core-0.7",
  "evaluation_context": {
    "assumption_policy": "no_compatible_from_unknown",
    "evaluation_timestamp": "2026-09-02T00:00:00Z",
    "evidence_timestamp": "2026-09-02T00:00:00Z",
    "omst_version": "0.7.0",
    "ruleset_version": "omst-core-0.7"
  },
  "settlement_intent": {
    "asset": "synthetic-tokenised-bond",
    "cash": {
      "amount": "50000000",
      "currency": "EUR"
    },
    "intent_id": "intent-tokenized-bond-dvp",
    "intent_type": "TOKENIZED_BOND_DVP",
    "omst_schema_version": "0.3.0",
    "omst_type": "settlement-intent",
    "participants": [
      "synthetic-buyer",
      "synthetic-seller"
    ],
    "requirements": {
      "atomicity": true,
      "availability": "24_7",
      "finality": "qualified",
      "maximum_latency_seconds": 60
    },
    "venue": "synthetic-venue",
    "x-note": "Synthetic example. Not an issuer assessment. Not a regulatory assessment. Not a representation of actual market conditions."
  },
  "money_profile": {
    "access_profile": {
      "institutional": true,
      "retail": false
    },
    "claim_type": "digital_money",
    "control_profile": {
      "freeze_possible": true
    },
    "currency": "EUR",
    "evidence": [],
    "functions": {
      "collateral": "conditional",
      "cross_border": "conditional",
      "liquidity": "supported",
      "payment": "supported",
      "programmable_transfer": "supported",
      "redemption": "supported",
      "settlement": "supported",
      "store_of_value": "conditional",
      "treasury": "supported"
    },
    "id": "EUR-X",
    "issuer": "Synthetic Issuer X",
    "monetary_layer_reference": "m1_reference",
    "name": "Synthetic EUR Money X",
    "network_profile": {
      "network": "synthetic-ledger"
    },
    "omst_type": "money-profile",
    "redemption_profile": {
      "at_par": true,
      "latency_seconds": 30
    },
    "settlement_profile": {
      "availability": "24_7",
      "finality_type": "qualified"
    },
    "transfer_profile": {
      "limits": "synthetic",
      "transferable": true
    },
    "x-note": "Synthetic example. Not an issuer assessment. Not a regulatory assessment. Not a representation of actual market conditions."
  },
  "money_state": {
    "availability": "available",
    "encumbrance": "none",
    "evidence_status": "VALID",
    "finality": "qualified",
    "instrument": "EUR-X",
    "operational_status": "operational",
    "redemption": "redeemable",
    "settlement": "settlement_ready",
    "transferability": "transferable"
  },
  "settlement_profile": {
    "atomicity": true,
    "availability": "24_7",
    "evidence": [],
    "finality": "qualified",
    "interoperability": {
      "adapter": "generic",
      "profile": "OMST-INTEROPERABILITY"
    },
    "latency": {
      "maximum_seconds": 60,
      "observed_seconds": 45
    },
    "name": "Synthetic Settlement Network A",
    "omst_type": "settlement-profile",
    "operating_windows": [
      "24_7"
    ],
    "settlement_profile_id": "settlement-network-a",
    "supported_assets": [
      "synthetic-tokenised-bond"
    ],
    "supported_money": [
      "EUR-X",
      "EUR-Y"
    ],
    "supported_settlement_modes": [
      "DVP",
      "ATOMIC"
    ],
    "transaction_limits": {
      "currency": "EUR",
      "maximum_amount": "150000000"
    },
    "version": "2026-09-01",
    "x-note": "Synthetic settlement environment. Not an operator attestation."
  },
  "money_requirement_set": {
    "composition": "AND",
    "description": "Synthetic EUR tokenized bond DvP cash-leg requirements.",
    "omst_type": "money-requirement-set",
    "requirement_set_id": "TOKENIZED_BOND_DVP_EUR",
    "requirements": [
      {
        "operator": "EQUALS",
        "priority": "MANDATORY",
        "property": "currency",
        "value": "EUR"
      },
      {
        "operator": "IN",
        "priority": "MANDATORY",
        "property": "finality",
        "value": [
          "qualified",
          "deterministic",
          "central-bank-final"
        ]
      },
      {
        "operator": "EQUALS",
        "priority": "MANDATORY",
        "property": "atomicity",
        "value": true
      },
      {
        "operator": "EQUALS",
        "priority": "MANDATORY",
        "property": "availability",
        "value": "24_7"
      },
      {
        "operator": "LESS_THAN_OR_EQUAL",
        "priority": "MANDATORY",
        "property": "maximum_latency_seconds",
        "unit": "seconds",
        "value": 60
      },
      {
        "evidence_requirement": {
          "accepted_sources": [
            "observed",
            "derived"
          ],
          "maximum_age_seconds": 60,
          "required": true
        },
        "operator": "GREATER_THAN_OR_EQUAL",
        "priority": "MANDATORY",
        "property": "effective_liquidity",
        "unit": "EUR",
        "value": "50000000"
      },
      {
        "operator": "EQUALS",
        "priority": "MANDATORY",
        "property": "transferability",
        "value": true
      },
      {
        "operator": "EQUALS",
        "priority": "MANDATORY",
        "property": "access",
        "value": "institutional"
      }
    ],
    "ruleset_version": "omst-core-0.7",
    "schema_version": "0.7.0",
    "x-note": "Synthetic example. Not an issuer assessment. Not a regulatory assessment. Not a representation of actual market conditions."
  },
  "evidence_manifest": {
    "omst_type": "evidence-manifest",
    "manifest_id": "evidence-tokenized-bond-dvp-eur-x-v07",
    "created_at": "2026-09-02T00:00:00Z",
    "evidence_items": [],
    "policy": {
      "accepted_sources": {
        "availability": [
          "official",
          "observed"
        ],
        "effective_liquidity": [
          "observed",
          "derived"
        ],
        "finality": [
          "official",
          "derived"
        ]
      },
      "max_age_seconds": {
        "availability": 86400,
        "effective_liquidity": 60,
        "finality": 86400
      }
    },
    "snapshot_reference": "synthetic://snapshot/tokenized-bond-dvp/EUR-X/2026-09-02"
  },
  "evidence_policy": {
    "accepted_sources": {
      "availability": [
        "official",
        "observed"
      ],
      "effective_liquidity": [
        "observed",
        "derived"
      ],
      "finality": [
        "official",
        "derived"
      ]
    },
    "max_age_seconds": {
      "availability": 86400,
      "effective_liquidity": 60,
      "finality": 86400
    }
  },
  "evaluation_result": {
    "assumptions": [
      "synthetic reference data",
      "no hidden network calls",
      "no compatible result from unknown evidence"
    ],
    "blocking_conditions": [],
    "capability_evaluation": {
      "results": [
        {
          "observed_value": "EUR",
          "reasons": [],
          "requirement": {
            "evidence_requirement": null,
            "operator": "EQUALS",
            "priority": "MANDATORY",
            "property": "currency",
            "unit": null,
            "value": "EUR"
          },
          "status": "COMPATIBLE"
        },
        {
          "observed_value": true,
          "reasons": [],
          "requirement": {
            "evidence_requirement": null,
            "operator": "EQUALS",
            "priority": "MANDATORY",
            "property": "atomicity",
            "unit": null,
            "value": true
          },
          "status": "COMPATIBLE"
        },
        {
          "observed_value": true,
          "reasons": [],
          "requirement": {
            "evidence_requirement": null,
            "operator": "EQUALS",
            "priority": "MANDATORY",
            "property": "transferability",
            "unit": null,
            "value": true
          },
          "status": "COMPATIBLE"
        },
        {
          "observed_value": "institutional",
          "reasons": [],
          "requirement": {
            "evidence_requirement": null,
            "operator": "EQUALS",
            "priority": "MANDATORY",
            "property": "access",
            "unit": null,
            "value": "institutional"
          },
          "status": "COMPATIBLE"
        }
      ],
      "status": "COMPATIBLE"
    },
    "confidence": "synthetic-reference",
    "evaluation_context": {
      "assumption_policy": "no_compatible_from_unknown",
      "evaluation_timestamp": "2026-09-02T00:00:00Z",
      "evidence_timestamp": "2026-09-02T00:00:00Z",
      "omst_version": "0.7.0",
      "ruleset_version": "omst-core-0.7"
    },
    "evaluation_hash": "343575ed699a556fbb987af9501eb089396859003ac3c6cb9206e2c37caaf59b",
    "evaluation_id": "eval-intent-tokenized-bond-dvp-EUR-X",
    "evidence_evaluation": {
      "results": [
        {
          "observed_value": 45,
          "reasons": [],
          "requirement": {
            "evidence_requirement": null,
            "operator": "LESS_THAN_OR_EQUAL",
            "priority": "MANDATORY",
            "property": "maximum_latency_seconds",
            "unit": "seconds",
            "value": 60
          },
          "status": "COMPATIBLE"
        },
        {
          "observed_value": "120000000",
          "reasons": [],
          "requirement": {
            "evidence_requirement": {
              "accepted_sources": [
                "observed",
                "derived"
              ],
              "maximum_age_seconds": 60,
              "required": true
            },
            "operator": "GREATER_THAN_OR_EQUAL",
            "priority": "MANDATORY",
            "property": "effective_liquidity",
            "unit": "EUR",
            "value": "50000000"
          },
          "status": "COMPATIBLE"
        }
      ],
      "status": "COMPATIBLE"
    },